{
  "$schema": "http://json-schema.org/draft-07/schema#",
  "title": "ECDAT Vulnerability Release Gate Schema",
  "description": "Schema defining 4-tier vulnerability release gating, formal risk acceptance, and documented severity override evidence.",
  "type": "object",
  "required": ["version", "tier_definitions", "anti_tamper_policy"],
  "properties": {
    "version": {
      "type": "string",
      "enum": ["1.0.0", "1.1.0"]
    },
    "description": {
      "type": "string"
    },
    "tier_definitions": {
      "type": "object",
      "required": ["CRITICAL", "HIGH", "MEDIUM", "LOW"],
      "properties": {
        "CRITICAL": {
          "type": "object",
          "required": ["action", "blocking", "risk_acceptance_allowed", "sla_days"],
          "properties": {
            "action": { "type": "string", "enum": ["RELEASE_BLOCKER"] },
            "blocking": { "type": "boolean", "enum": [true] },
            "risk_acceptance_allowed": { "type": "boolean", "enum": [false] },
            "sla_days": { "type": "integer", "minimum": 0, "maximum": 1 }
          }
        },
        "HIGH": {
          "type": "object",
          "required": ["action", "blocking", "risk_acceptance_allowed", "sla_days"],
          "properties": {
            "action": { "type": "string", "enum": ["CONDITIONAL_BLOCKER"] },
            "blocking": { "type": "boolean", "enum": [true] },
            "risk_acceptance_allowed": { "type": "boolean", "enum": [true] },
            "sla_days": { "type": "integer", "minimum": 1, "maximum": 14 }
          }
        },
        "MEDIUM": {
          "type": "object",
          "required": ["action", "blocking", "tracking_category", "sla_days"],
          "properties": {
            "action": { "type": "string", "enum": ["TRACKED_REMEDIATION"] },
            "blocking": { "type": "boolean", "enum": [false] },
            "tracking_category": { "type": "string", "enum": ["remediation_queue"] },
            "sla_days": { "type": "integer", "minimum": 1, "maximum": 90 }
          }
        },
        "LOW": {
          "type": "object",
          "required": ["action", "blocking", "tracking_category", "sla_days"],
          "properties": {
            "action": { "type": "string", "enum": ["TRACKED_IMPROVEMENT"] },
            "blocking": { "type": "boolean", "enum": [false] },
            "tracking_category": { "type": "string", "enum": ["improvement_backlog"] },
            "sla_days": { "type": "integer", "minimum": 1, "maximum": 180 }
          }
        }
      }
    },
    "anti_tamper_policy": {
      "type": "object",
      "required": ["prohibit_undocumented_downgrades", "evidence_requirements"],
      "properties": {
        "prohibit_undocumented_downgrades": { "type": "boolean", "enum": [true] },
        "evidence_requirements": {
          "type": "array",
          "items": { "type": "string" }
        }
      }
    }
  }
}
