{
  "$schema": "rules/schemas/vulnerability_release_gate.schema.json",
  "version": "1.0.0",
  "description": "ECDAT Enterprise Vulnerability Release Gate Policy (Phase 23.3)",
  "tier_definitions": {
    "CRITICAL": {
      "action": "RELEASE_BLOCKER",
      "blocking": true,
      "risk_acceptance_allowed": false,
      "description": "Unconditional release blocker. Any unmitigated critical vulnerability immediately halts deployment.",
      "sla_days": 0
    },
    "HIGH": {
      "action": "CONDITIONAL_BLOCKER",
      "blocking": true,
      "risk_acceptance_allowed": true,
      "description": "Release blocker unless formally risk-accepted by authorized Security Architecture Lead with documented mitigation.",
      "sla_days": 14
    },
    "MEDIUM": {
      "action": "TRACKED_REMEDIATION",
      "blocking": false,
      "tracking_category": "remediation_queue",
      "description": "Tracked remediation with SLA assignment. Non-blocking at release unless SLA is breached.",
      "sla_days": 60
    },
    "LOW": {
      "action": "TRACKED_IMPROVEMENT",
      "blocking": false,
      "tracking_category": "improvement_backlog",
      "description": "Tracked continuous improvement in engineering backlog. Non-blocking.",
      "sla_days": 180
    }
  },
  "anti_tamper_policy": {
    "prohibit_undocumented_downgrades": true,
    "enforce_evidence_hash_check": true,
    "minimum_justification_chars": 30,
    "evidence_requirements": [
      "finding_id",
      "base_severity",
      "overridden_severity",
      "evidence_type",
      "evidence_document_uri",
      "evidence_sha256",
      "justification",
      "approved_by",
      "approved_at",
      "expires_at"
    ]
  }
}
